{
  "$schema": "https://json-schema.org/draft/2020-12/schema",
  "$id": "https://schemas.agent-ix.org/agent-ix/spec-artifacts-process/Task.json",
  "type": "object",
  "properties": {
    "id": {
      "$ref": "https://schemas.agent-ix.org/agent-ix/spec-artifacts-process/MixedDocId.json"
    },
    "title": {
      "$ref": "https://schemas.agent-ix.org/agent-ix/spec-artifacts-process/NonEmptyText.json"
    },
    "type": {
      "type": "string",
      "const": "Task"
    },
    "object": {
      "$ref": "https://schemas.agent-ix.org/agent-ix/spec-artifacts-process/ObjectTypeName.json"
    },
    "status": {
      "$ref": "https://schemas.agent-ix.org/agent-ix/spec-artifacts-process/NonEmptyText.json",
      "description": "free text: the authored lifecycle word (`todo`, `done`); the archetype declares no vocabulary for it."
    },
    "track": {
      "$ref": "https://schemas.agent-ix.org/agent-ix/spec-artifacts-process/NonEmptyText.json",
      "description": "The parallel-execution track label (FR-005). A property of a Task; a consumer needing a tree node synthesises one."
    },
    "relationships": {
      "type": "array",
      "items": {
        "$ref": "https://schemas.agent-ix.org/agent-ix/spec-artifacts-process/Relationship.json"
      },
      "description": "Absent when the author declared none; the frontmatter schemas do not require the key, and the model must not require what the schema does not (FR-011-AC-15)."
    },
    "provenance": {
      "$ref": "https://schemas.agent-ix.org/agent-ix/spec-artifacts-process/Provenance.json"
    },
    "body": {
      "$ref": "https://schemas.agent-ix.org/agent-ix/spec-artifacts-process/Section.json",
      "description": "free text: the whole authored body; the archetype declares no `body_extraction`."
    }
  },
  "required": [
    "id",
    "title",
    "type",
    "provenance",
    "body"
  ],
  "unevaluatedProperties": {
    "not": {}
  },
  "description": "Task record (archetype `Task`). The authored unit of work: its track, its\ndependencies and the tests it verifies. Not a record of the task being done."
}
